{
  "$schema": "../schemas/quest.schema.json",
  "id": "first-lessons-stone",
  "title": "First Lessons: Stone",
  "introNarration": "Mentor Quern keeps the hearth dummy in sight. Granite takes the cool light and does not complain. The air smells of wet rock after rain and mason's chalk. \"Look around this hearth. Weight first. Speech second. Defeat the hearth dummy in this room — not Flint's orchard dummy. Then come back and talk to me. I will ink three leaves in your Field Primer.\"",
  "reminderNarration": "Look around this hearth. Defeat the hearth dummy here. Then talk to Quern. He has not hurried the sentence, and he will not drop it.",
  "completionNarration": "Quern inks three starter leaves at rank 1. Stone-dust from his paw greys the margin. The next lesson will ask you to cast.",
  "experienceReward": 15,
  "objectives": [
    {
      "id": "look-hearth",
      "kind": "look",
      "label": "Look around the hearth.",
      "roomId": "hearth-stone"
    },
    {
      "id": "defeat-dummy",
      "kind": "defeat",
      "label": "Defeat the hearth dummy.",
      "targetId": "enemy-practice-dummy-hearth-stone",
      "roomId": "hearth-stone",
      "requires": ["look-hearth"]
    },
    {
      "id": "report",
      "kind": "talk",
      "label": "Return and talk to Mentor Quern.",
      "targetId": "npc-mentor-quern",
      "requires": ["defeat-dummy"]
    }
  ]
}
