{
  "$schema": "../schemas/quest.schema.json",
  "id": "first-lessons-ember",
  "title": "First Lessons: Ember",
  "introNarration": "Mentor Cinder keeps the hearth dummy in sight. The copper grate ticks. There is a ghost of oatcakes left too near the coals. \"Look around this hearth. Smell the soot and name the fire before you feed it. Defeat the hearth dummy in this room — not Flint's orchard dummy. Then come back and talk to me. I will ink three leaves in your Field Primer.\"",
  "reminderNarration": "Look around this hearth. Defeat the hearth dummy here. Then talk to Cinder. The grate is still warm, and she is still waiting.",
  "completionNarration": "Cinder inks three starter leaves at rank 1. The Primer smells faintly of smoke and new ink. The next lesson will ask you to cast.",
  "experienceReward": 15,
  "objectives": [
    {
      "id": "look-hearth",
      "kind": "look",
      "label": "Look around the hearth.",
      "roomId": "hearth-ember"
    },
    {
      "id": "defeat-dummy",
      "kind": "defeat",
      "label": "Defeat the hearth dummy.",
      "targetId": "enemy-practice-dummy-hearth-ember",
      "roomId": "hearth-ember",
      "requires": ["look-hearth"]
    },
    {
      "id": "report",
      "kind": "talk",
      "label": "Return and talk to Mentor Cinder.",
      "targetId": "npc-mentor-cinder",
      "requires": ["defeat-dummy"]
    }
  ]
}
