{
  "$schema": "../schemas/quest.schema.json",
  "id": "the-empty-byre",
  "title": "The Empty Byre",
  "giverNpcId": "npc-foldhand-hobb",
  "requiresQuestIds": ["the-meadow-fork"],
  "experienceReward": 20,
  "itemRewardTemplateId": "fold-mitts",
  "introNarration": "Hobb trims the lamp and does not sit down. \"Byre north of Wren's croft. Straw banked up the walls, gate sound, latch still dropped. Not one sheep in it.\" He sets the lamp on the bench harder than he meant to. \"No wool caught on the nails. No prints in the mud outside. Go and examine the empty stall yourself, then try the mist-lane east of it. Something has been standing in that lane three nights running and the fog does not move around it. Come back and talk hobb. I would rather know than keep guessing at my own straw.\"",
  "reminderNarration": "\"Examine the empty stall north of the croft. Defeat the fold-hound in the mist-lane if it is still there. Then talk hobb. Type north from Wren's Croft. Type east from the byre.\"",
  "completionNarration": "Hobb hears you out, then goes and stands in the lane himself for a while to see that it is only a lane. When he comes back he pulls the mitts off his own paws and puts them in yours. \"Take those. The mist gets into your claws out here and you will want them.\" He looks at the empty bell-loop again. \"It was not a sheep and it was not a dog, and I still have no bell. Sile is at the mere north of the lane, and she has her own wrong thing. Talk sile. Eat at the croft on your way.\"",
  "objectives": [
    {
      "id": "read-stall",
      "kind": "examine",
      "targetId": "object-empty-stall",
      "label": "Examine the Empty Stall in the Croft Byre. Type north from Wren's Croft."
    },
    {
      "id": "defeat-hound",
      "kind": "defeat",
      "targetId": "enemy-fold-hound-mist-lane",
      "label": "Defeat the Fold Hound in the Mist Lane. Type east from the Croft Byre."
    },
    {
      "id": "report",
      "kind": "talk",
      "targetId": "npc-foldhand-hobb",
      "requires": ["read-stall", "defeat-hound"],
      "label": "Talk hobb in the Wool Shed. Type east from the croft, or south from the lane."
    }
  ]
}
