{
  "$schema": "../schemas/quest.schema.json",
  "id": "the-pressed-mask",
  "title": "The Pressed Mask",
  "giverNpcId": "npc-stairkeeper-vane",
  "requiresQuestIds": ["the-bell-wakes"],
  "experienceReward": 25,
  "outcomes": [
    {
      "id": "worn",
      "completionNarration": "You put it on in front of her.\n\nVane does not flinch and does not look away either, which costs her something. She holds the lamp up and studies the muzzle-print where your own face should be. \"Right,\" she says. \"That is what it does.\" She writes two lines in the stair log and reads the second one out loud so you hear it as a fact and not a scolding: the mask is above the cloister, and a Collegian is wearing it.\n\n\"Keep it if you are keeping it. I would rather know who has it than wonder.\" She goes back to the wick. \"Everyone who talks to you today is going to do that thing with their eyes. That is the cost. It was always the cost.\""
    },
    {
      "id": "returned",
      "completionNarration": "You carry it up unworn and set it on the step in the lamplight, which is all she asked for.\n\nVane turns it over twice with the wick shears rather than her paws. \"Silk. Pressed round somebody and then left.\" She writes one line in the stair log and puts the mask on the high ledge, face down, where it can be seen from the stair. \"I am not hiding it and I am not burning it. Somebody will want to know it exists.\"\n\nThen she presses the flat tin into your paws. \"Wick, taper, rag. A lit stair is worth more than a brave one, and you did the duller thing on purpose. Holm would have had opinions about you, and they would have been good ones.\"",
      "itemRewardTemplateId": "vanes-wick-tin"
    }
  ],
  "introNarration": "Vane sets the shears down. \"Two turns below the gallery there is a cloister with webs in the arches. On the floor there is a face.\" She lets that sit. \"Not a body. A shell of silk pressed round a face and then left, hard as a nutshell and about as heavy. I have seen it from the arch and I have not gone in for it, and you may write that down anywhere you like.\"\n\nShe picks the shears back up. \"Bring it up into lamplight. Carry it or wear it, that is yours to decide, but I want to be looking at it in good light either way. Then talk vane.\"",
  "reminderNarration": "\"The cloister below the gallery. Type take mask. Then bring it up to the stair and talk vane, or put it on first. Either way I want it in lamplight.\"",
  "objectives": [
    {
      "id": "reach-cloister",
      "kind": "visit",
      "roomId": "webbed-cloister",
      "label": "Reach the Webbed Cloister below the Silk Gallery."
    },
    {
      "id": "lift-mask",
      "kind": "take",
      "itemTemplateId": "pressed-mask",
      "roomId": "webbed-cloister",
      "requires": ["reach-cloister"],
      "label": "Take the Pressed Mask. Type take mask."
    },
    {
      "id": "put-it-on",
      "kind": "equip",
      "itemTemplateId": "pressed-mask",
      "requires": ["lift-mask"],
      "outcome": "worn",
      "label": "Wear it and let Vane see. Type equip mask."
    },
    {
      "id": "carry-it-up",
      "kind": "talk",
      "targetId": "npc-stairkeeper-vane",
      "requires": ["lift-mask"],
      "outcome": "returned",
      "label": "Or carry it up unworn. Type talk vane."
    }
  ]
}
