{
  "$schema": "../schemas/quest.schema.json",
  "id": "first-lessons-steel",
  "title": "First Lessons: Steel",
  "introNarration": "Mentor Edge keeps the hearth dummy in sight. Mail hangs in a neat row, oiled and unromantic. The air smells of metal, leather, and linseed. \"Look around this hearth. Name the stance before you swing. Defeat the hearth dummy in this room — not Flint's orchard dummy. Then come back and talk to me. I will open this School's leaf and ink its stem in your Field Primer.\"",
  "reminderNarration": "Look around this hearth. Defeat the hearth dummy here. Then talk to Edge. The anvil is still bright from honest work.",
  "completionNarration": "Edge inks the stem at rank I. A smear of oil darkens one corner of the page. The next lesson will ask you to cast.",
  "experienceReward": 15,
  "objectives": [
    {
      "id": "look-hearth",
      "kind": "look",
      "label": "Look around the hearth.",
      "roomId": "hearth-steel"
    },
    {
      "id": "defeat-dummy",
      "kind": "defeat",
      "label": "Defeat the hearth dummy.",
      "targetId": "enemy-practice-dummy-hearth-steel",
      "roomId": "hearth-steel",
      "requires": ["look-hearth"]
    },
    {
      "id": "report",
      "kind": "talk",
      "label": "Return and talk to Mentor Edge.",
      "targetId": "npc-mentor-edge",
      "requires": ["defeat-dummy"]
    }
  ]
}
