{
  "$schema": "../schemas/quest.schema.json",
  "id": "the-missing-pages",
  "title": "The Missing Pages",
  "giverNpcId": "npc-librarian-quill",
  "experienceReward": 10,
  "introNarration": "Quill opens A Small Guide to Remarkable Woodland Birds beneath the green-shaded lamp. Cloth bookmarks hang from neighbouring volumes like bright tongues, and the little clock ticks much more quietly than seems mechanically reasonable. One awkward gap shows where the lantern-wren page ought to sit. \"The lantern-wren entry is missing — the page about the bird that carries its own small lantern through dusk. Read the Ink Blotter in the Scriptorium, west of these stacks, where the air smells of gall and drying paper. Then the Folded Page in the Music Loft, west of the North Quad, where a stand has been wobbling through three verses. Please examine both, then come back and talk quill. Leave the fragile page where it is; tell me where to collect it. We need a careful reader, not a tug-of-war. Blame is a poor bookmark.\"",
  "reminderNarration": "Quill taps the gap in the field guide with one careful talon. Ink has dried on her waistcoat like a constellation of honest mistakes. \"Examine the Ink Blotter in the Scriptorium and the Folded Page in the Music Loft. Then talk quill here. Type west to reach the Scriptorium. Type west to reach the Music Loft from the North Quad. Type east to reach Library Stacks. Type quests to check your notes. I would rather have the words back than a name to scold.\"",
  "completionNarration": "Quill listens to your account of the copied birdsong and the wobbly music stand. The green lamp makes a small, patient circle on the register. \"An unfinished errand, then, not a thief.\" She writes down where to collect the page and prepares a proper wooden wedge for the stand. \"You found the missing words without inventing an accusation. That is good scholarship. The lantern wren may now go home to its book.\"",
  "objectives": [
    {
      "id": "read-blotter",
      "kind": "examine",
      "targetId": "object-ink-blotter",
      "label": "Examine the Ink Blotter in the Scriptorium (west of Library Stacks). Type west to reach the Scriptorium."
    },
    {
      "id": "find-page",
      "kind": "examine",
      "targetId": "object-folded-page",
      "label": "Examine the Folded Page in the Music Loft (west of North Quad). Type west to reach the Music Loft."
    },
    {
      "id": "report",
      "kind": "talk",
      "targetId": "npc-librarian-quill",
      "requires": ["read-blotter", "find-page"],
      "label": "After both discoveries, talk quill in Library Stacks. Type east to reach Library Stacks."
    }
  ]
}
