{
  "$schema": "../schemas/quest.schema.json",
  "id": "what-the-fog-took",
  "title": "What the Fog Took",
  "giverNpcId": "npc-shepherd-wren",
  "requiresQuestIds": ["the-barrow-mouth"],
  "experienceReward": 40,
  "itemRewardTemplateId": "fog-glass-bead",
  "introNarration": "Wren does not sit. The peat fire pops. \"The lip of the barrow. Examine what the fog took. Then talk wren here. Then talk fen in the Infirmary — soap, rosemary, honey, the breathing wheel. I am owed the name before Alder is. Sit with Fen after. Nobody earns extra courage by pretending not to hurt.\"",
  "reminderNarration": "\"Examine what the fog took under the barrow lip. Talk wren. Then talk fen. Type east from the Porter Lodge for the Infirmary. Type quests for the list. Whatever you find, report it as you found it.\"",
  "completionNarration": "You told Wren, then sat with Fen until your paws felt like paws again. Wren closes your paw around a fog-glass bead. Two keepers. Two witnesses who lived. Piper under the tower. Wren at the kettle. Eat. The bronze in the hill is Alder's question now.",
  "objectives": [
    {
      "id": "read-colm",
      "kind": "examine",
      "targetId": "object-colm-aftermath",
      "label": "Examine what the fog took under the Barrow Mouth lip. Leave him covered. Do not talk colm."
    },
    {
      "id": "tell-wren",
      "kind": "talk",
      "targetId": "npc-shepherd-wren",
      "requires": ["read-colm"],
      "label": "Talk wren at the croft before Alder. She is owed that."
    },
    {
      "id": "sit-fen",
      "kind": "talk",
      "targetId": "npc-healer-fen",
      "requires": ["tell-wren"],
      "label": "Talk fen in the Infirmary. Sit. Honey. Type east from the Porter Lodge."
    }
  ]
}
