{
  "$schema": "../schemas/quest.schema.json",
  "id": "the-bell-wakes",
  "title": "The Bell Wakes",
  "experienceReward": 15,
  "itemRewardTemplateId": "piper-stair-charm",
  "introNarration": "Alder picks the fork up and sets it down again, slower this time. The oak chair creaks. Somewhere below the Clock Tower a warmer note answers, closer than the old abbey sound, and it comes up through the floor rather than down from the tower. \"You already proved the wood can carry a welcome. Something below the Clock Tower has begun to answer. I would not send a first-year down that stair if I had another pair of eyes I trusted. Piper Mole has been alone in the Silk Gallery too long. He sits on a crate with silk-dust on both paws, and he is afraid. Talk to him. Examine the Stair Rope, the Silk Thread, and the Waking Husk. Then come back and talk alder here. One hungry child is not proof of a queen. Look first, and name what you actually saw. I am counting on you.\"",
  "reminderNarration": "Alder counts the stair on one talon. The scarred eye stays shut. \"East from the North Quad. Down from the Clock Tower — the rope will pulse in your paw like a living thing. Talk piper in the Silk Gallery. He has been holding that dark with a dented tin whistle, and he deserves to be heard. Examine the Stair Rope, the Silk Thread — warm as bread from an oven — and the Waking Husk in the Cocoon Nave, where the husks hang like empty lanterns. Then talk alder here. Type quests for the list. Finish this before the silk learns another name.\"",
  "completionNarration": "You report the pulsing rope, the warm thread, Piper's watch, and the opened husk still smelling faintly of sweetness that should not be sweet so far below. Alder listens to the end. For a moment the High Study is only ink, dust, and the faint answering shiver of the fork. \"A hatchling woke before the score allows. The silk is a cradle, not a throne. That is enough for one Collegian, and you were the Collegian I asked. When three can stand together, we will ask what still sleeps.\"",
  "objectives": [
    {
      "id": "check-rope",
      "kind": "examine",
      "targetId": "object-stair-rope",
      "label": "Examine the Stair Rope on the Bell Stair. Feel whether the pulses still climb the oak. Type down from the Clock Tower."
    },
    {
      "id": "hear-piper",
      "kind": "talk",
      "targetId": "npc-piper-mole",
      "label": "Talk piper in the Silk Gallery. He has been alone down there, and Alder wants you to hear him. Type down from the Bell Stair."
    },
    {
      "id": "check-thread",
      "kind": "examine",
      "targetId": "object-silk-thread",
      "label": "Examine the Silk Thread in the Silk Gallery. Piper needs someone else to name what it is doing."
    },
    {
      "id": "check-husk",
      "kind": "examine",
      "targetId": "object-waking-husk",
      "label": "Examine the Waking Husk in the Cocoon Nave. Prove whether a child woke too soon. Type east then south from the gallery."
    },
    {
      "id": "report",
      "kind": "talk",
      "targetId": "npc-headmaster-alder",
      "requires": ["check-rope", "hear-piper", "check-thread", "check-husk"],
      "label": "Take the stair, Piper, thread, and husk back to Alder in the High Study. Type up from the Great Hall."
    }
  ]
}
