{
  "$schema": "../schemas/quest.schema.json",
  "id": "arrival-at-the-collegium",
  "title": "Arrival at the Collegium",
  "introNarration": "A sturdy hedgehog in a worn porter's coat steps out from the lanterns, whistle on a leather cord, quills neat as a roll-call.",
  "reminderNarration": "Porter Bramble stays at your side until Arrival is finished.",
  "experienceReward": 10,
  "objectives": [
    {
      "id": "look",
      "kind": "look",
      "label": "Look around Lantern Court. Type look to see Lantern Court."
    },
    {
      "id": "speak",
      "kind": "say",
      "label": "Say hello so Porter knows you arrived."
    },
    {
      "id": "take",
      "kind": "take",
      "label": "Take the Small Copper Key from Porter. Type take key.",
      "itemTemplateId": "small-copper-key"
    },
    {
      "id": "arrive",
      "kind": "visit",
      "label": "Type north to reach the Great Hall.",
      "roomId": "great-hall"
    }
  ]
}
