{
  "$schema": "../schemas/quest.schema.json",
  "id": "the-mere-that-keeps",
  "title": "The Mere That Keeps",
  "giverNpcId": "npc-reedcutter-sile",
  "requiresQuestIds": ["the-empty-byre"],
  "experienceReward": 20,
  "itemRewardTemplateId": "reed-cloak",
  "introNarration": "Sile lays a cut reed flat on the water and holds it there. Not one ripple goes out from it. \"That is not right, and you can see for yourself that it is not right.\" She takes the reed back. \"Go and examine the still water, close enough to see there is nothing under that light holding it up. If it squares up at you, finish it. Then talk sile. I do not want a mystery. I want a mere I can call across.\"",
  "reminderNarration": "\"Examine the still water. Defeat the reed-wisp if it is on the mere. Then talk sile. Type north from the Mist Lane.\"",
  "completionNarration": "Sile walks to the edge, cups her paws, and shouts her brother's name across the water. It comes back off the far reeds, thin but whole. She listens to it a little longer than she needs to. \"There.\" She takes the short oiled cloak off her own shoulders and puts it on yours. \"Kern is east past the stones, chalking lintels and getting a number he does not care for. He counts stones, I count reeds, and neither of us goes near that barrow. Tell him the mere gave my voice back.\"",
  "objectives": [
    {
      "id": "read-mere",
      "kind": "examine",
      "targetId": "object-still-water",
      "label": "Examine the Still Water at Reed Mere. Type north from the Mist Lane."
    },
    {
      "id": "defeat-wisp",
      "kind": "defeat",
      "targetId": "enemy-reed-wisp-reed-mere",
      "label": "Defeat the Reed Wisp at Reed Mere."
    },
    {
      "id": "report",
      "kind": "talk",
      "targetId": "npc-reedcutter-sile",
      "requires": ["read-mere", "defeat-wisp"],
      "label": "Talk sile at Reed Mere."
    }
  ]
}
